{
  "schema": "testing-case-result.v2",
  "case_id": "case-lost",
  "repository": {"id": "repo", "source_ref": {"kind": "git", "ref": "repo@commit"}, "source_sha256": "aaaaaaaaaaaaaaaaaaaaaaaaaaaaaaaaaaaaaaaaaaaaaaaaaaaaaaaaaaaaaaaa"},
  "reviewed_case_id": "reviewed-case-lost",
  "plan_ref": {"kind": "plan", "ref": "plans/1"},
  "plan_sha256": "aaaaaaaaaaaaaaaaaaaaaaaaaaaaaaaaaaaaaaaaaaaaaaaaaaaaaaaaaaaaaaaa",
  "execution_mode": "http",
  "execution_status": "lost",
  "classification": "lost",
  "observations": [],
  "assertions": [{"schema": "testing-assertion-result.v1", "assertion_id": "assert-1", "type": "document-ready", "required": true, "status": "skipped", "classification": "skipped", "observation_ids": [], "evidence_refs": []}],
  "evidence_refs": [],
  "timing": {"started_at": "2026-08-25T00:00:00Z", "completed_at": "2026-08-25T00:00:00Z", "duration_ms": 0},
  "non_execution_reason": "runner-disconnected",
  "trace_id": "trace-1",
  "dedup_key": "dedup-1"
}
